{
  "schemaVersion": "1.0.0",
  "assignmentId": "PVA-AUDIO-SYNC-001",
  "candidateId": "synthetic-candidate-001",
  "domain": "narration-audio",
  "assignedFindingIds": ["PVF-AUDIO-SYNC-001"],
  "permittedFiles": [
    "video/audio/timeline.json",
    "video/audio/narration.wav",
    "video/tests/synchronization.test.mjs"
  ],
  "prohibitedFiles": [
    "video/capture",
    "video/product-seed",
    "evidence/source"
  ],
  "evidence": [
    {
      "artifactId": "sync-report",
      "artifactPath": "evidence/synchronization-report.json",
      "sha256": "cccccccccccccccccccccccccccccccccccccccccccccccccccccccccccccccc",
      "description": "Word timestamps aligned to the deterministic frame timeline."
    }
  ],
  "reproductionSteps": [
    "Render the current synthetic candidate.",
    "Run the synchronization checker against the immutable candidate."
  ],
  "validationCommands": [
    {
      "command": "node video/tests/synchronization.test.mjs",
      "expectedResult": "The payoff cue starts within one frame of the visible result."
    }
  ],
  "definitionOfDone": [
    "The assigned finding is reproduced before the change.",
    "The smallest coherent timing correction is implemented.",
    "The targeted synchronization test passes.",
    "A new immutable candidate and evidence package are created."
  ],
  "permissions": {
    "writeScope": "assigned-files-only",
    "mayApproveRelease": false,
    "destructiveGitAllowed": false,
    "forcePushAllowed": false,
    "broadWorkspaceWritesAllowed": false,
    "mayDeleteSourceEvidence": false
  }
}
